Time,F-Scale,Location,County,State,Lat,Lon,Comments
1630,UNK,RANDLEMAN,RANDOLPH,NC,35.82,-79.8,TREES AND POWER LINES DOWN REPORTED BY THE FIRE DEPARTMENT. (RAH)
1635,UNK,1 E RANDLEMAN,RANDOLPH,NC,35.82,-79.78,LAW ENFORCEMENT REPORTED AN OUTBUILDING WAS LEVELED ON APPLEWOOD ROAD AND SHINGLES BLOWN OFF A ROOF. IN ADDITION... NUMEROUS TREES AND POWER LINES HAVE BEEN REPORTED DO (RAH)
1700,UNK,4 E HIGH POINT,GUILFORD,NC,35.97,-79.92,TROOPER REPORTED TORNADO ON THE GROUND NEAR 2970 RIVER ROAD NEAR JAMESTOWN. (RAH)
1723,UNK,4 E GOLDSTON,CHATHAM,NC,35.59,-79.26,STATE TROOPER REPORTED A TORNADO ON THE GROUND NORTH OF GULF. (RAH)
1725,UNK,6 W WILSON,WILSON,NC,35.73,-78.03,LAW ENFORCEMENT REPORTED A TORNANDO TOUCHDOWN NEAR HIGHWAY 42 AND LLOYD ROAD. (RAH)
1735,UNK,RANDLEMAN,RANDOLPH,NC,35.82,-79.8,LAW ENFORCEMENT REPORTED OUTBUILDING WAS LEVELED ON APPLEWOOD ROAD. (RAH)
1744,UNK,3 SSW LINWOOD,JOHNSTON,NC,35.71,-78.33,LAW ENFORCEMENT REPORTED TORNADO ON THE GROUND AT COVERED BRIDGE ROAD AND THANKSGIVING FIRE ROAD. MULTIPLE TREES DOWN IN ROAD. (RAH)
1755,UNK,6 NW WILSON,WILSON,NC,35.79,-78,SPOTTERS REPORT TORNADO ON THE GROUND NEAR I-95 AND BLOOMERY ROAD. (RAH)
1809,UNK,4 NW NEW HOPE,NASH,NC,35.84,-77.99,TORNADO TOUCHDOWN HIGHWAY 97,ONE HALF MILE WEST OF INTERSTATE 95. (RAH)
1813,UNK,3 W NEW HOPE,WILSON,NC,35.79,-78.01,SPOTTER REPORTED BRIEF TOUCHDOWN IN A TOBACCO AND SOYBEAN FIELD NEAR LAMM ROAD AND BLOOMERY ROAD. CURRENTLY ALOFT BUT WALL CLOUD STILL ROTATING. (RAH)
1915,UNK,4 NW NEW HOPE,NASH,NC,35.84,-77.99,TORNADO TOUCHDOWN HIGHWAY 97,ONE HALF MILE WEST OF INTERSTATE 95. (RAH)
2008,UNK,5 NNE SILER CITY,CHATHAM,NC,35.78,-79.42,AN EF-0 TORNADO TRACKED NORTHEAST ALONG JESSE BRIDGES ROAD CROSSING SILK HOPE LIBERTY ROAD DESTROYING AN OUTBUILDING...CAUSING MINOR DAMAGE TO HOMES AND UPROOTING TREES (RAH)
2323,UNK,ROSE HILL,DUPLIN,NC,34.83,-78.03,LAW ENFORCEMENT REPORTED A TORNADO ON THE GROUND ON HIGHWAY 117 BETWEEN ROSE HILL AND TEACHEY. NO DAMAGE OBSERVED. (MHX)
2330,UNK,ROSE HILL,DUPLIN,NC,34.83,-78.03,POSSIBLE TORNADO. REPORTS OF MULTIPLE POWER OUTAGES IN THE ROSE HILL AND TEACHEY AREA. (MHX)
0457,UNK,4 NE FREMONT,WAYNE,NC,35.58,-77.93,A LARGE BARN WAS DESTROYED NEAR THE WAYNE/WILSON COUNTY LINE... IN WAYNE COUNTY ALONG AYCOCK CHURCH ROAD. (RAH)
0502,UNK,5 NNE FREMONT,WILSON,NC,35.6,-77.93,SEVERAL TREES REPORTED AND DOWN AND A BASKETBALL GOAL BLOWN OVER ALONG SOUTH BEAVER DAM ROAD... JUST NORTH OF THE WAYNE/WILSON COUNTY LINE. (RAH)
Time,Speed,Location,County,State,Lat,Lon,Comments
1647,UNK,6 NW TURKEY,SAMPSON,NC,35.06,-78.24,A FEW TREES WERE BLOWN DOWN ACROSS OLD WARSAW ROAD. (RAH)
1836,UNK,5 ENE ASHEBORO,RANDOLPH,NC,35.76,-79.73,ONE TREE REPORTED DOWN ACROSS WHITE MEMORIAL ROAD BLOCKING TRAFFIC... NEAR RIVER RAT ROAD. TIME ESTIMATED BY RADAR. (RAH)
2030,UNK,1 NE SILER CITY,CHATHAM,NC,35.74,-79.45,SEVERAL TREES DOWN ABOUT A MILE NORTHEAST OF SILER CITY ON JESSE BRIDGES ROAD. (RAH)
2200,UNK,ST. DAVID,COCHISE,AZ,31.9,-110.23,THREE WOOD UTILITY POLES BLOWN DOWN IN THE CENTER OF THE CITY...ON STATE ROUTE 80. (TWC)
0315,60,2 NNE SIOUX CITY,WOODBURY,IA,42.53,-96.39,SEVERAL TREES DOWN AND CHIMNEY KNOCKED DOWN (FSD)
0620,UNK,2 NW ANTHON,WOODBURY,IA,42.41,-95.89,4 INCH DIAMETER TREE LIMBS DOWN (FSD)
Time,Size,Location,County,State,Lat,Lon,Comments
2120,100,2 E WORTHING,LINCOLN,SD,43.33,-96.73,(FSD)
2200,88,3 E LARCHWOOD,LYON,IA,43.46,-96.38,(FSD)
0150,88,5 S ROCHESTER,OLMSTED,MN,43.94,-92.48,(ARX)
0330,88,PENDER,THURSTON,NE,42.11,-96.71,(OAX)
0355,75,3 N BANCROFT,CUMING,NE,42.05,-96.57,(OAX)
0425,75,DECATUR,BURT,NE,42.01,-96.25,(OAX)
0500,75,3 SW TURIN,MONONA,IA,41.99,-96.01,(OAX)
0540,75,3 WNW OTO,WOODBURY,IA,42.3,-95.95,4 TO 6 DIAMETER INCH TREE LIMBS DOWN (FSD)
0700,75,5 WNW OTO,WOODBURY,IA,42.32,-95.98,(FSD)
0850,75,8 NNW HARRISON,AURORA,SD,43.54,-98.62,(FSD)
